Title,Author,Filename,Category,Bumper Sticker,Original Language,Country,Year,Wiki Link,Wiki Text
"A System of Logic, Ratiocinative and Inductive","Mill, John Stuart",mill_system.txt,Inductive Reasoning,System of logic using empiricist principles,English,United Kingdom,1843,https://en.wikipedia.org/wiki/A_System_of_Logic,"A System of Logic, Ratiocinative and Inductive is an 1843 book by English philosopher John Stuart Mill. In this work, he formulated the five principles of inductive reasoning that are known as Mill's Methods. This work is important in the philosophy of science, and more generally, insofar as it outlines the empirical principles Mill would use to justify his moral and political philosophies. An article in ""Philosophy of Recent Times"" has described this book as an ""attempt to expound a psychological system of logic within empiricist principles.”

This work was important to the history of science, being a strong influence on scientists such as Dirac.[1][2] A System of Logic also had an impression on Gottlob Frege, who rebuked many of Mill's ideas about the philosophy of mathematics in his work The Foundations of Arithmetic.[3]

Mill revised the original work several times over the course of thirty years in response to critiques and commentary by Whewell, Bain, and others."
Thus Spake Zarathustra,"Nietzsche, Friedrich",nietzsche_zara.txt,Perspectivism,All ideations take place from particular perspectives,German,Germany,1891,https://en.wikipedia.org/wiki/Thus_Spoke_Zarathustra,"Thus Spoke Zarathustra: A Book for All and None (German: Also sprach Zarathustra: Ein Buch für Alle und Keinen, also translated as Thus Spake Zarathustra) is a philosophical novel by German philosopher Friedrich Nietzsche, composed in four parts between 1883 and 1885 and published between 1883 and 1891.[1] Much of the work deals with ideas such as the ""eternal recurrence of the same"", the parable on the ""death of God"", and the ""prophecy"" of the Übermensch, which were first introduced in The Gay Science.[2]"
The Republic,Plato,plato_republic.txt,Political Philosophy,"The just state is ruled by the philosopher-king, striving for the ideal forms",Greek,Greece,380 BC,https://en.wikipedia.org/wiki/Republic_(Plato),"The Republic (Greek: Πολιτεία, Politeia; Latin: Res Publica[1]) is a Socratic dialogue, written by Plato around 380 BC, concerning justice (δικαιοσύνη), the order and character of the just city-state, and the just man.[2] It is Plato's best-known work, and has proven to be one of the world's most influential works of philosophy and political theory, both intellectually and historically.[3][4]

In the dialogue, Socrates discusses with various Athenians and foreigners about the meaning of justice and whether the just man is happier than the unjust man.[5] They consider the natures of existing regimes and then propose a series of different, hypothetical cities in comparison, culminating in Kallipolis (Καλλίπολις), a city-state ruled by a philosopher king. They also discuss the theory of forms, the immortality of the soul, and the role of the philosopher and of poetry in society.[6] The dialog's setting seems to be during the Peloponnesian War.[7]"
Theaetetus,Plato,plato_theaetetus.txt,Theory of Forms,"The physical world is not as real or true as eternal, absolute, unchangeable ideas",Greek,Greece,369 BC,https://en.wikipedia.org/wiki/Theaetetus_(dialogue),"The Theaetetus (/ˌθiːɪˈtiːtəs/; Greek: Θεαίτητος) is one of Plato's dialogues concerning the nature of knowledge, written circa 369 BCE.

In this dialogue, Socrates and Theaetetus discuss three definitions of knowledge: knowledge as nothing but perception, knowledge as true judgment, and, finally, knowledge as a true judgment with an account. Each of these definitions is shown to be unsatisfactory.

Socrates declares Theaetetus will have benefited from discovering what he does not know, and that he may be better able to approach the topic in the future. The conversation ends with Socrates' announcement that he has to go to court to face a criminal indictment."
The Social Contract,"Rousseau, Jean-Jacques",rousseau_contract.txt,Social Contract,The people are sovereign in forming a political community to address problems in a commercial society,French,France,1762,https://en.wikipedia.org/wiki/The_Social_Contract,"The Social Contract, originally published as On the Social Contract; or, Principles of Political Rights (French: Du contrat social; ou Principes du droit politique) by Jean-Jacques Rousseau, is a 1762 book in which Rousseau theorized about the best way to establish a political community in the face of the problems of commercial society, which he had already identified in his Discourse on Inequality (1754).

The Social Contract helped inspire political reforms or revolutions in Europe, especially in France. The Social Contract argued against the idea that monarchs were divinely empowered to legislate. Rousseau asserts that only the people, who are sovereign, have that all-powerful right."
The Analysis of Mind,"Russell, Bertrand",russell_analysis.txt,Analytic Philosophy,Modern empiricism allows philosophical questions to have scientific answers,English,United Kingdom,1921,https://en.wikipedia.org/wiki/Bertrand_Russell,"Bertrand Arthur William Russell, 3rd Earl Russell, OM FRS[64] (/ˈrʌsəl/; 18 May 1872 – 2 February 1970) was a British philosopher, logician, mathematician, historian, writer, social critic, political activist, and Nobel laureate.[65][66] At various points in his life, Russell considered himself a liberal, a socialist and a pacifist, although he also confessed that his skeptical nature had led him to feel that he had ""never been any of these things, in any profound sense.""[67] Russell was born in Monmouthshire into one of the most prominent aristocratic families in the United Kingdom.[68]

In the early 20th century, Russell led the British ""revolt against idealism"".[69] He is considered one of the founders of analytic philosophy along with his predecessor Gottlob Frege, colleague G. E. Moore and protégé Ludwig Wittgenstein. He is widely held to be one of the 20th century's premier logicians.[66] With A. N. Whitehead he wrote Principia Mathematica, an attempt to create a logical basis for mathematics, the quintessential work of classical logic. His philosophical essay ""On Denoting"" has been considered a ""paradigm of philosophy"".[70] His work has had a considerable influence on mathematics, logic, set theory, linguistics, artificial intelligence, cognitive science, computer science (see type theory and type system) and philosophy, especially the philosophy of language, epistemology and metaphysics.

Russell was a prominent anti-war activist and he championed anti-imperialism.[71][72] Occasionally, he advocated preventive nuclear war, before the opportunity provided by the atomic monopoly had passed and ""welcomed with enthusiasm"" world government.[73] He went to prison for his pacifism during World War I.[74] Later, Russell concluded that war against Adolf Hitler's Nazi Germany was a necessary ""lesser of two evils"" and criticised Stalinist totalitarianism, attacked the involvement of the United States in the Vietnam War and was an outspoken proponent of nuclear disarmament.[75] In 1950, Russell was awarded the Nobel Prize in Literature ""in recognition of his varied and significant writings in which he champions humanitarian ideals and freedom of thought"".[76][77]"
The Ethics,"Spinoza, Baruch",spinoza_ethics.txt,Rationalism,Reason is the chief source and test of knowledge,Latin,"Dutch Republic 
(Netherlands)",1677,https://en.wikipedia.org/wiki/Ethics_(Spinoza),"Ethics, Demonstrated in Geometrical Order (Latin: Ethica, ordine geometrico demonstrata), usually known as the Ethics, is a philosophical treatise written in Latin by Benedict de Spinoza. It was written between 1664 and 1665[citation needed] and was first published posthumously in 1677.

The book is perhaps the most ambitious attempt to apply the method of Euclid in philosophy. Spinoza puts forward a small number of definitions and axioms from which he attempts to derive hundreds of propositions and corollaries, such as ""When the Mind imagines its own lack of power, it is saddened by it"",[1] ""A free man thinks of nothing less than of death"",[2] and ""The human Mind cannot be absolutely destroyed with the Body, but something of it remains which is eternal.""[3]"
"Walden, and On the Duty of Civil Disobedience","Thoreau, Henry David",thoreau_walden.txt,Transcendentalism,"People and nature are inherently good, and people are at their best when self-reliant and independent",English,United States,1854,https://en.wikipedia.org/wiki/Walden,"Walden (/ˈwɔːldən/; first published as Walden; or, Life in the Woods) is a book by transcendentalist Henry David Thoreau. The text is a reflection upon simple living in natural surroundings. The work is part personal declaration of independence, social experiment, voyage of spiritual discovery, satire, and—to some degree—a manual for self-reliance.[2]

First published in 1854, Walden details Thoreau's experiences over the course of two years, two months, and two days in a cabin he built near Walden Pond amidst woodland owned by his friend and mentor Ralph Waldo Emerson, near Concord, Massachusetts. Thoreau used this time to write his first book, A Week on the Concord and Merrimack Rivers. The experience later inspired Walden, in which Thoreau compresses the time into a single calendar year and uses passages of four seasons to symbolize human development.

The book can be seen as performance art, a demonstration of how easy it can be to acquire the four necessities of life. Once acquired, he believed people should then focus their efforts on personal growth.

By immersing himself in nature, Thoreau hoped to gain a more objective understanding of society through personal introspection. Simple living and self-sufficiency were Thoreau's other goals, and the whole project was inspired by transcendentalist philosophy, a central theme of the American Romantic Period.

Thoreau makes precise scientific observations of nature as well as metaphorical and poetic uses of natural phenomena. He identifies many plants and animals by both their popular and scientific names, records in detail the color and clarity of different bodies of water, precisely dates and describes the freezing and thawing of the pond, and recounts his experiments to measure the depth and shape of the bottom of the supposedly ""bottomless"" Walden Pond."